recordId	lastName	firstName	middleName	dateOfBirth	sex	code	series	number	issueDate	issuedBy	unitCode	addressText	universityCode	facultyCode	code	date	startDate	course	educationType	number	date	type	studentId
1	Иванова	Юлия	Сергеевна	1992-11-04	2	21	1412	287888	2012-11-06	ТП в пос. Томаровка МО УФМС России по Белгородской области в городе Строитель		309085, Россия, Белгородская обл, Яковлевский р-н, п Томаровка, ул Ленина, д 44	777	18615	1	2014-08-05	2014-08-05	2	DAYTIME	1664-С	2014-07-25	1	124157
2	Петрова	Элина	Фаритовна	1990-10-28	2	21	9410	139351	2010-11-29	 МО УФМС по Удмуртской республике г. Сарапул		427967, Россия, Респ Удмуртская, г Сарапул, ул Пугачева, д 67, кв 41	777	18615	1	2014-08-05	2014-08-05	2	DAYTIME	1664-с	2014-07-25	1	124181
3	Сидорова	Рузиля	Бикбулатовна	1992-03-01	2	21	7112	936560	2012-08-01	Межрайонным отделом УФМС России по Тюменской области в городе Тобольске		626156, Россия, Тюменская обл, г Тобольск, мкр 30-й, д 12, кв 1	777	18615	1	2014-08-05	2014-08-05	2	DAYTIME	1664-с	2014-07-25	1	124183
4	Дашкина	Алевтина	Владимировна	1989-04-13	2	21	8009	848334	2009-07-01	отделом УФМС России по республике Башкортостан в Октябрьском районе города Уфы		450105, Россия, г Уфа, ул И.Франка, д 21, кв 42	777	18615	1	2014-08-05	2014-08-05	2	DAYTIME	1664-с	2014-07-25	1	124198
5	Пупкина	Анжела	Зейнуллаевна	1993-06-04	2	21	4513	169981	2013-06-27	ОТДЕЛОМ УФМС РОССИИ ПО ГОР.МОСКВЕ ПО РАЙОНУ МАРЬИНО		109559, Россия, г Ростов, ул Цимлянская, д 24 к 2, кв 193	777	18615	1	2014-08-05	2014-08-05	2	DAYTIME	1664-с	2014-07-25	1	124223
6	Смит	Анастасия	Юрьевна	1992-06-01	2	21	2811	184857	2012-06-06	Отделом УФМС России по Тверской области в Московском районе гор.Твери		170028, Россия, г Клин, ул Фадеева, д 46, кв 136	777	18615	1	2014-08-05	2014-08-05	2	DAYTIME	1664-с	2014-07-25	1	124249
7	Пушкина	Далья	Михайловна	1993-05-27	2	21	4513	130816	2013-06-21	отделением УФМС России по гор.Москве по району проспект Вернадского		119415, Россия, г Москва, пр-кт Ленинский, д 14 к 1, кв 43	777	18615	1	2014-08-05	2014-08-05	2	DAYTIME	1664-с	2014-07-25	1	124408
